<!ELEMENT branches (branch+)>
<!ELEMENT branch (address, contact, hours, map)>
<!ELEMENT address (#PCDATA)>
<!ELEMENT contact (#PCDATA)>
<!ELEMENT hours (#PCDATA)>
<!ELEMENT map (#PCDATA)>